<?xml version="1.0" encoding="UTF-8" ?>
<!DOCTYPE aftale SYSTEM "aftale.dtd">
<aftale>
    <info>
        <cpr></cpr>
        <date></date>
        <time></time>
        <hospital></hospital>
        <afdeling></afdeling>
        <adresse></adresse>
    </info>
</aftale>